{
    "categoryName": "Lifeblood Core%",
    "splitIds": [
        "VengefulSpirit",
        "EnterGreenpath",
        "MothwingCloak",
        "MantisClaw",
        "BlueLake",
        "GorgeousHusk",
        "JonisBlessing",
        "KingsBrand",
        "LifebloodCore"
    ],
    "endTriggeringAutosplit": true,
    "gameName": "Hollow Knight Category Extensions",
    "pauseOnMainMenu": true
}
