{
    "categoryName": "Low% Spelless",
    "splitIds": [
        "GruzMother",
        "Mask1",
        "DreamNail",
        "MantisClaw",
        "Hegemol",
        "BlackKnight",
        "Lurien",
        "CrystalHeart",
        "Uumuu",
        "Monomon"
    ],
    "endTriggeringAutosplit": false,
    "endingSplit": {
        "name": "Hollow Knight",
        "icon": "HollowKnightBoss"
    },
    "gameName": "Hollow Knight Category Extensions",
    "pauseOnMainMenu": true
}
