{
    "categoryName": "Enraged Guardian%",
    "splitIds": [
        "VengefulSpirit",
        "EnterGreenpath",
        "MothwingCloak",
        "MantisClaw",
        "BlueLake",
        "GorgeousHusk",
        "LumaflyLantern",
        "CrystalGuardian1",
        "CrystalGuardian2"
    ],
    "endTriggeringAutosplit": true,
    "gameName": "Hollow Knight Category Extensions",
    "pauseOnMainMenu": true
}
