{
    "categoryName": "Shriek%",
    "splitIds": [
        "VengefulSpirit",
        "EnterGreenpath",
        "MothwingCloak",
        "MantisClaw",
        "HowlingWraiths",
        "BlueLake",
        "KingdomsEdgeEntry",
        "KingsBrand",
        "BasinEntry",
        "AbyssShriek"
    ],
    "endTriggeringAutosplit": true,
    "gameName": "Hollow Knight Category Extensions",
    "pauseOnMainMenu": true
}
