{
    "categoryName": "Clawless Shade Cloak",
    "splitIds": [
        "VengefulSpirit",
        "EnterGreenpath",
        "MothwingCloak",
        "KingdomsEdgeEntry",
        "EnterHornet2",
        "KingsBrand",
        "ShadeCloak"
    ],
    "endTriggeringAutosplit": true,
    "gameName": "Hollow Knight Category Extensions",
    "pauseOnMainMenu": true
}
