{
    "categoryName": "5 Mimics",
    "splitIds": [
        "VengefulSpirit",
        "EnterGreenpath",
        "MothwingCloak",
        "MantisClaw",
        "Mimic3",
        "BlueLake",
        "Lemm2",
        "CrystalHeart",
        "Mimic4",
        "LittleFool",
        "ColosseumBronze",
        "Mimic5"
    ],
    "endTriggeringAutosplit": true,
    "gameName": "Hollow Knight Category Extensions",
    "pauseOnMainMenu": true
}
