{
    "categoryName": "Nice%",
    "splitIds": [
        "FuryOfTheFallen",
        "VengefulSpirit",
        "SoulCatcher",
        "MothwingCloak",
        "MantisClaw",
        "MantisLords",
        "MarkOfPride",
        "Dashmaster",
        "GruzMother",
        "ShamanStone",
        "DashSlash",
        "ShadeSoul",
        "SpellTwister",
        "DesolateDive",
        "CrystalHeart",
        "DescendingDark",
        "DreamNail",
        "Dreamshield",
        "Lurien",
        "Flukenest",
        "DefendersCrest",
        "IsmasTear",
        "MonarchWings",
        "KingsBrand",
        "CycloneSlash",
        "Gorb",
        "JonisBlessing",
        "BaldurShell",
        "GreatSlash",
        "ThornsOfAgony",
        "NailmastersGlory",
        "WaywardCompass",
        "Grubsong",
        "Mask1",
        "FragileStrength",
        "ElderHu",
        "Monomon",
        "HowlingWraiths",
        "Hegemol",
        "Xero",
        "SoulEater",
        "QuickFocus",
        "ShadeCloak",
        "AbyssShriek"
    ],
    "endTriggeringAutosplit": false,
    "endingSplit": {
        "name": "Hollow Knight",
        "icon": "HollowKnightBoss"
    },
    "gameName": "Hollow Knight Category Extensions",
    "pauseOnMainMenu": true
}
