{
    "categoryName": "All Whispering Roots",
    "splitIds": [
        "VengefulSpirit",
        "EnterGreenpath",
        "MothwingCloak",
        "DreamNail",
        "MantisClaw",
        "TreeMantisVillage",
        "TreeRestingGrounds",
        "TreeWaterways",
        "TreeCity",
        "LumaflyLantern",
        "TreePeak",
        "CrystalHeart",
        "TreeCliffs",
        "TreeCrossroads",
        "TreeMound",
        "TreeLegEater",
        "TreeGlade",
        "TreeQueensGardens",
        "TreeGreenpath",
        "TreeDeepnest",
        "TreeHive",
        "TreeKingdomsEdge"
    ],
    "endTriggeringAutosplit": true,
    "gameName": "Hollow Knight Category Extensions",
    "pauseOnMainMenu": true
}
