{
    "categoryName": "True Ending",
    "splitIds": [
        "FuryOfTheFallen",
        "VengefulSpirit",
        "SoulCatcher",
        "MothwingCloak",
        "NotchShrumalOgres",
        "TransClaw",
        "Lemm2",
        "SpellTwister",
        "DesolateDive",
        "StoreroomsStation",
        "SlyKey",
        "CrystalHeart",
        "DreamNail",
        "Dreamshield",
        "NotchSalubra1",
        "ElegantKey",
        "EnterSanctumWithShadeSoul",
        "SoulTyrantEssence",
        "Flukenest",
        "BrokenVessel",
        "LostKinEssence",
        "FailedChampionEssence",
        "DreamGate",
        "KingsStationStation",
        "KingsBrand",
        "ShadeCloak",
        "Markoth",
        "Lurien",
        "LumaflyLantern",
        "Monomon",
        "NoEyesEssence",
        "TollBenchQG",
        "MarmuEssence",
        "WhiteFragmentLeft",
        "GalienEssence",
        "Hegemol",
        "WhitePalaceEntry",
        "Kingsoul",
        "VoidHeart",
        "HollowKnightDreamnail"
    ],
    "endTriggeringAutosplit": false,
    "endingSplit": {
        "name": "Radiance",
        "icon": "RadianceBoss"
    },
    "gameName": "Hollow Knight",
    "pauseOnMainMenu": true
}
