{
    "categoryName": "All Unbreakable Charms",
    "splitIds": [
        "VengefulSpirit",
        "MothwingCloak",
        "MantisClaw",
        "MantisLords",
        "GruzMother",
        "DreamNail",
        "FragileStrength",
        "GorbEssence",
        "XeroEssence",
        "KingdomsEdgeEntry",
        "KingsStationStation",
        "GorgeousHusk",
        "BlackKnight",
        "Lemm2",
        "AllUnbreakables"
    ],
    "endTriggeringAutosplit": true,
    "gameName": "Hollow Knight Category Extensions",
    "pauseOnMainMenu": true
}
