{
    "categoryName": "Egg",
    "splitIds": [
        "OnObtainRancidEgg",
        "OnObtainRancidEgg",
        "OnObtainRancidEgg",
        "OnObtainRancidEgg",
        "OnObtainRancidEgg",
        "OnObtainRancidEgg",
        "OnObtainRancidEgg",
        "OnObtainRancidEgg",
        "OnObtainRancidEgg",
        "OnObtainRancidEgg",
        "OnObtainRancidEgg",
        "OnObtainRancidEgg",
        "OnObtainRancidEgg",
        "OnObtainRancidEgg",
        "OnObtainRancidEgg",
        "OnObtainRancidEgg",
        "OnObtainRancidEgg",
        "OnObtainRancidEgg",
        "OnObtainRancidEgg",
        "OnObtainRancidEgg",
        "OnObtainRancidEgg"
    ],
    "endTriggeringAutosplit": true,
    "gameName": "Hollow Knight Category Extensions",
    "pauseOnMainMenu": true
}
