{
    "categoryName": "PoP%",
    "splitIds": [
        "VengefulSpirit",
        "EnterGreenpath",
        "MothwingCloak",
        "BlueLake",
        "DreamNail",
        "ElderHuEssence",
        "MantisClaw",
        "GalienEssence",
        "XeroEssence",
        "GorgeousHusk",
        "LumaflyLantern",
        "SlyKey",
        "CrystalHeart",
        "ShadeSoul",
        "DesolateDive",
        "SoulTyrantEssence",
        "TollBenchBasin",
        "BrokenVessel",
        "MonarchWings",
        "DreamGate",
        "FailedChampionEssence",
        "GorbEssence",
        "NoEyesEssence",
        "WhitePalaceEntry",
        "PathOfPainEntry",
        "PathOfPain"
    ],
    "endTriggeringAutosplit": true,
    "gameName": "Hollow Knight Category Extensions",
    "pauseOnMainMenu": true
}
