{
    "categoryName": "Low%",
    "splitIds": [
        "VengefulSpirit",
        "EnterGreenpath",
        "FungalWastesEntry",
        "TransClaw",
        "DeepnestSpa",
        "TramPass",
        "DeepnestStation",
        "DreamNail",
        "WatcherChandelier",
        "BlackKnightTrans",
        "Lemm2",
        "LumaflyLantern",
        "CrystalHeart",
        "Uumuu",
        "BeastsDenTrapBench",
        "HegemolDreamer",
        "UnchainedHollowKnight"
    ],
    "endTriggeringAutosplit": false,
    "endingSplit": {
        "name": "Hollow Knight",
        "icon": "HollowKnightBoss"
    },
    "gameName": "Hollow Knight",
    "pauseOnMainMenu": true
}
