{
    "categoryName": "Florist%",
    "splitIds": [
        "-KingsPass",
        "-FalseKnight",
        "VengefulSpirit",
        "-EnterGreenpath",
        "MothwingCloak",
        "-MegaMossCharger",
        "-FogCanyonEntry",
        "-QueensStationStation",
        "-NotchShrumalOgres",
        "MantisClaw",
        "MantisLords",
        "-FragileHeart",
        "-CityGateOpen",
        "-killedSoulTwister",
        "-SpellTwister",
        "DesolateDive",
        "-TollBenchCity",
        "-OnObtainSimpleKey",
        "GruzMother",
        "-ShamanStone",
        "-CrystalPeakEntry",
        "-CrystalGuardian1",
        "-SlyKey",
        "CrystalHeart",
        "DescendingDark",
        "DreamNail",
        "-RestingGroundsStation",
        "-ElegantKey",
        "BroodingMawlek",
        "-FogCanyonEntry",
        "-NotchFogCanyon",
        "ShadeSoul",
        "-Lemm2",
        "-DungDefender",
        "-IsmasTear",
        "KingsBrand",
        "-KingsStationStation",
        "-Ore1",
        "-TollBenchBasin",
        "-OnObtainSimpleKey",
        "MonarchWings",
        "ShadeCloak",
        "-HiddenStationStation",
        "QueensGardensEntry",
        "-EnterDeepnest",
        "Nosk",
        "-QueensGardensFrogsTrans",
        "-Marmu",
        "TraitorLord",
        "-NailUpgrade2",
        "-ColosseumBronze",
        "ColosseumSilver",
        "Xero",
        "Gorb",
        "-Ore3",
        "-Flukemarm",
        "NailUpgrade3",
        "-VengeflyKingP",
        "-GruzMotherP",
        "-FalseKnightP",
        "-MassiveMossChargerP",
        "-Hornet1P",
        "-GorbP",
        "-DungDefenderP",
        "-SoulWarriorP",
        "-BroodingMawlekP",
        "-OroMatoNailBrosP",
        "Pantheon1",
        "-XeroP",
        "-CrystalGuardianP",
        "-SoulMasterP",
        "-OblobblesP",
        "-MantisLordsP",
        "-MarmuP",
        "-NoskP",
        "-FlukemarmP",
        "-BrokenVesselP",
        "-SheoPaintmasterP",
        "Pantheon2",
        "-ElderbugFlower",
        "-givenOroFlower",
        "-FlowerQuest",
        "-givenWhiteLadyFlower",
        "-givenEmilitiaFlower",
        "givenGodseekerFlower"
    ],
    "endTriggeringAutosplit": true,
    "gameName": "Hollow Knight Category Extensions",
    "pauseOnMainMenu": true
}
