{
    "categoryName": "Forgotten Corners AS TE",
    "splitIds": [
        "CrystalHeart",
        "VengefulSpirit",
        "MothwingCloak",
        "IsmasTear",
        "MantisClaw",
        "DreamNail",
        "MonarchWings",
        "GalienEssence",
        "Hegemol",
        "ShamanStone",
        "DesolateDive",
        "DreamGate",
        "DescendingDark",
        "DashSlash",
        "Lurien",
        "ShadeCloak",
        "LoveKey",
        "Monomon",
        "KingsBrand",
        "CycloneSlash",
        "ShadeSoul",
        "GreatSlash",
        "DreamNail2",
        "HowlingWraiths",
        "AbyssShriek",
        "VoidHeart",
        "HollowKnightDreamnail"
    ],
    "endTriggeringAutosplit": false,
    "endingSplit": {
        "name": "Radiance",
        "icon": "RadianceBoss"
    },
    "gameName": "Hollow Knight Mods",
    "pauseOnMainMenu": true
}
