{
    "categoryName": "Low% True Ending Dropless",
    "splitIds": [
        "-CrossroadsStation",
        "VengefulSpirit",
        "-EnterGreenpath",
        "MothwingCloak",
        "MantisClaw",
        "-DeepnestSpa",
        "TramPass",
        "-HiddenStationStation",
        "-KingsStationStation",
        "-DreamNail",
        "SlyRescued",
        "-TreeWaterways",
        "-WatcherChandelier",
        "-BlackKnight",
        "Lurien",
        "-Lemm2",
        "-EnterSanctum",
        "-SoulMaster",
        "SoulTyrantEssence",
        "-TreeCity",
        "-LumaflyLantern",
        "CrystalHeart",
        "-EnterHornet2",
        "KingsBrand",
        "-TreeKingdomsEdge",
        "-BenchRGStag",
        "-BrokenVessel",
        "LostKinEssence",
        "-DreamWielder",
        "FailedChampionEssence",
        "-DreamGate",
        "ShadeCloak",
        "MarkothEssence",
        "-OnObtainGhostGravedigger",
        "-TreeCrossroads",
        "-TreeMound",
        "-TreeLegEater",
        "-UumuuEncountered",
        "Monomon",
        "-QueensGardensEntry",
        "-TreeQueensGardens",
        "-QueensGardensPostArenaTransition",
        "WhiteFragmentLeft",
        "-TreeDeepnest",
        "GalienEssence",
        "-BeastsDenTrapBench",
        "Hegemol",
        "-DreamNail2",
        "-Kingsoul",
        "VoidHeart",
        "-HollowKnightDreamnail"
    ],
    "endTriggeringAutosplit": false,
    "endingSplit": {
        "name": "Radiance",
        "icon": "RadianceBoss"
    },
    "gameName": "Hollow Knight Category Extensions",
    "variables": {
        "True Ending Glitch": "1.4.3.2+ NMG"
    },
    "pauseOnMainMenu": true
}
