{
    "categoryName": "Salubra's Blessing% CMO",
    "splitIds": [
        "WaywardCompass",
        "GatheringSwarm",
        "StalwartShell",
        "SoulCatcher",
        "ShamanStone",
        "SoulEater",
        "Dashmaster",
        "Sprintmaster",
        "Grubsong",
        "GrubberflysElegy",
        "FragileHeart",
        "FragileGreed",
        "FragileStrength",
        "SpellTwister",
        "SteadyBody",
        "HeavyBlow",
        "QuickSlash",
        "Longnail",
        "MarkOfPride",
        "FuryOfTheFallen",
        "ThornsOfAgony",
        "BaldurShell",
        "Flukenest",
        "DefendersCrest",
        "GlowingWomb",
        "QuickFocus",
        "DeepFocus",
        "LifebloodHeart",
        "LifebloodCore",
        "JonisBlessing",
        "Hiveblood",
        "SporeShroom",
        "SharpShadow",
        "ShapeOfUnn",
        "NailmastersGlory",
        "Weaversong",
        "DreamWielder",
        "Dreamshield",
        "Grimmchild",
        "Kingsoul",
        "SalubrasBlessing"
    ],
    "endTriggeringAutosplit": true,
    "gameName": "Hollow Knight Category Extensions",
    "pauseOnMainMenu": true
}
